{
    "$schema": "https://json-schema.org/draft/2019-09/schema",
    "type": "object",
    "required": ["args", "expected"],
    "properties": {
        "$schema": {"type": "string"},
        "linear": {"type": "boolean"},
        "disabled": {"type": ["string", "boolean"]},
        "lang": {"type": "boolean"},
        "args": {"type": "string"},
        "post": {"type": ["string", "array"], "items": {"type": "string"}},
        "expected": {"type": ["array", "null"]},
        "patches": {
            "type": "object",
            "properties": {
                "^$": {"not": {}},
                "^.+$": {"type": "string"}
            }
        },
        "prepare": {
            "type": ["string", "array"],
            "items": {"type": ["string", "array"], "items": {"type": "string"}}
        },
        "cleanup": {
            "type": ["string", "array"],
            "items": {"type": ["string", "array"], "items": {"type": "string"}}
        }
    },
    "additionalProperties": false,
    "default": {}
}