{
    "args": "init",
    "patches": {
        "cov init: error: argument -C: .*": "cov init: error: argument -C: ERROR MESSAGE"
    },
    "expected": [
        2,
        "",
        [
            "usage: cov init [-h] [--git-dir <dir>] [--force] [directory]",
            "cov init: error: argument -C: ERROR MESSAGE\n"
        ]
    ],
    "prepare": [
        "safe-rm '$TMP/init-git-dir-no-cwd'",
        "mkdirs '$TMP/init-git-dir-no-cwd/subdir'",
        "cd '$TMP/init-git-dir-no-cwd/subdir'",
        "rm '$TMP/init-git-dir-no-cwd'"
    ]
}
