{
    "args": "checkout -b branch-name G~",
    "post": [
        "branch --show-current",
        "log --oneline -n1"
    ],
    "expected": [
        0,
        [
            "branch-name",
            "",
            "dd6999226    0%  Commit H b2a86e548@main\n"
        ],
        ""
    ],
    "prepare": [
        "unpack $DATA/revparse.tar $TMP",
        "cd $TMP/revparse",
        "cov log --oneline"
    ]
}
