{
    "$schema": "../../runner-schema.json",
    "args": "show",
    "patches": {
        "report [0-9a-f]{40}": "report $OID",
        "build  [0-9a-f]{40} (.*)": "build  $BUILD_HASH \\1"
    },
    "expected": [
        0,
        [
            "report $OID",
            "commit 3845124429f44888c0152dc1929ec6853bc1c9f0",
            "build  $BUILD_HASH [ 67%]",
            "GitBranch: main",
            "Coverage:  [ 67%] 2/3 (fail)",
            "Author:    Johnny Appleseeed <johnny@appleseed.com>",
            "Added:     $DATE",
            "",
            "      second",
            "",
            "+-------+---------+---------+----------+---------+------------+",
            "| Name  | % Lines | Visited | Relevant | Missing | Line count |",
            "+-------+---------+---------+----------+---------+------------+",
            "| D src |   66.67 |       2 |        3 |       1 |          5 |",
            "+-------+---------+---------+----------+---------+------------+\n"
        ],
        ""
    ],
    "prepare": [
        "unpack $DATA/repo.git.tar $TMP",
        "cd '$TMP'",
        "git clone repo.git",
        "cd '$TMP/repo'",
        "cov init",
        "cov report $DATA/build-coverage.json -f create-report"
    ]
}
