{
    "args": "checkout -b branch-name",
    "post": [
        "branch --show-current",
        "log --oneline -n1"
    ],
    "expected": [
        0,
        [
            "branch-name",
            "",
            "1232e2f9e    0%  Commit D 0398a2156@main\n"
        ],
        ""
    ],
    "prepare": [
        "unpack $DATA/revparse.tar $TMP",
        "cd $TMP/revparse",
        "cov log --oneline"
    ]
}
