{
    "args": "show HEAD:src/main.cc --color always",
    "patches": {
        "report [0-9a-f]{40}": "report $REPORT_HASH",
        "commit [0-9a-f]{40}": "commit $COMMIT_HASH",
        "build  [0-9a-f]{40} (.*)": "build  $BUILD_HASH \\1",
        "Added:     .*": "Added:     $NOW"
    },
    "expected": [
        0,
        [
            "\u001b[33mfile src/main.cc\u001b[m",
            "",
            "+-----------+--------------+---------+---------+---------+----------+---------+------------+",
            "| Name      |   % Funcs    | Missing | % Lines | Visited | Relevant | Missing | Line count |",
            "+-----------+--------------+---------+---------+---------+----------+---------+------------+",
            "|   main.cc | \u001b[1;31m50.00\u001b[m \u001b[2;31m-50.00\u001b[m |    1 \u001b[2;31m+1\u001b[m |   \u001b[1;31m66.67\u001b[m |       6 |        9 |       3 |         17 |",
            "+-----------+--------------+---------+---------+---------+----------+---------+------------+",
            "",
            "\u001b[2;49;39m      500x |\u001b[m \u001b[2;49;32mfoo()\u001b[m",
            "  1 |   0x | \u001b[0;49;31m-\u001b[1;31mvoid\u001b[0;49;31m foo() {\u001b[m",
            "  2 |   0x | \u001b[0;49;31m-    std::cout << \u001b[0;49;91m\"\u001b[2;49;91mHello, \u001b[0;49;91m\"\u001b[0;49;31m << name() << \u001b[0;49;91m\"\u001b[2;49;91m!\u001b[0;49;91m\"\u001b[0;49;31m;\u001b[m",
            "  3 |      |  }",
            "  4 |      |  ",
            "\u001b[2;49;39m        0x |\u001b[m \u001b[2;49;31mbar()\u001b[m",
            "  5 |  15x | \u001b[0;49;32m+\u001b[1;32mvoid\u001b[0;49;32m bar() {\u001b[m",
            "  6 |      |      foo();",
            "  7 |  10x | \u001b[0;49;32m+    foo();\u001b[m",
            "  8 |   8x | \u001b[0;49;32m+    foo();\u001b[m",
            "  9 |   6x | \u001b[0;49;32m+    foo();\u001b[m",
            " 10 |   4x | \u001b[0;49;32m+    foo();\u001b[m",
            " 11 |   2x | \u001b[0;49;32m+    foo();\u001b[m",
            " 12 |   0x | \u001b[0;49;31m-    foo();\u001b[m",
            " 13 |      |      foo();",
            " 14 |      |      foo();",
            " 15 |      |      foo();",
            "\n"
        ],
        ""
    ],
    "prepare": [
        "unpack $DATA/repo.git.tar $TMP",
        "cd '$TMP'",
        "git clone repo.git",
        "cd '$TMP/repo'",
        "git config --local user.name 'Johnny Appleseed'",
        "git config --local user.email 'johnny@appleseed.com'",
        "cov init",
        "cov report $DATA/build-coverage-show-functions-1.json -f create-report",
        "cov report $DATA/build-coverage-show-functions-2.json -f create-report"
    ]
}
