{
    "args": "checkout --orphan branch-name",
    "post": [
        "branch --show-current",
        "log --oneline -n1"
    ],
    "expected": [
        2,
        "branch-name\n",
        "cov log: error: HEAD refers to branch with no reports\n"
    ],
    "prepare": [
        "unpack $DATA/revparse.tar $TMP",
        "cd $TMP/revparse"
    ]
}
