{
    "$schema": "../../../../build/downloads/runner-schema.json",
    "args": "show same..sies",
    "patches": {
        "report [0-9a-f]{40}": "report $REPORT_HASH",
        "commit [0-9a-f]{40}": "commit $COMMIT_HASH",
        "build  [0-9a-f]{40} (.*)": "build  $BUILD_HASH \\1"
    },
    "expected": [
        0,
        [
            "report $REPORT_HASH",
            "commit $COMMIT_HASH",
            "build  $BUILD_HASH [ 86%]",
            "GitBranch: main",
            "Coverage:  [ 86%] 6/7 (incomplete)",
            "Author:    Johnny Appleseed <johnny@appleseed.com>",
            "Added:     $DATE",
            "",
            "      reported files",
            "",
            "+---------+---------+---------+----------+---------+------------+",
            "| Name    | % Lines | Visited | Relevant | Missing | Line count |",
            "+---------+---------+---------+----------+---------+------------+",
            "| D lib   |  100.00 |       4 |        4 |         |          7 |",
            "| D src   |   66.67 |       2 |        3 |       1 |          6 |",
            "+---------+---------+---------+----------+---------+------------+",
            "| > TOTAL |   85.71 |       6 |        7 |       1 |         13 |",
            "+---------+---------+---------+----------+---------+------------+\n"
        ],
        ""
    ],
    "prepare": [
        "unpack $DATA/repo.git.tar $TMP",
        "cd '$TMP'",
        "git clone repo.git",
        "cd '$TMP/repo'",
        "git config --local user.name 'Johnny Appleseed'",
        "git config --local user.email 'johnny@appleseed.com'",
        "cov init",
        "cov report $DATA/build-coverage-show-modules.json -f create-report",
        "cov tag same",
        "cov tag sies"
    ]
}
